{
  "schema_version": "1.0",
  "meta": {
    "project_id": "introducing-rescript",
    "run_id": "run-20260212-0101",
    "episode_id": "E01",
    "source_script_path": ".tmp/projects/introducing-rescript/run-20260212-0101/script/E01_script.md",
    "generated_at": "2026-02-11T15:48:51.875Z"
  },
  "utterances": [
    {
      "utterance_id": "U001",
      "section_id": 1,
      "section_title": "オープニング",
      "text": "今日は、TypeScriptやJavaScriptで開発しているエンジニアが、",
      "pause_length_ms": 230
    },
    {
      "utterance_id": "U002",
      "section_id": 1,
      "section_title": "オープニング",
      "text": "なぜ今ReScriptを検討する価値があるのかを整理します。",
      "pause_length_ms": 340
    },
    {
      "utterance_id": "U003",
      "section_id": 1,
      "section_title": "オープニング",
      "text": "ゴールは、ReScriptの導入価値を、",
      "pause_length_ms": 190
    },
    {
      "utterance_id": "U004",
      "section_id": 1,
      "section_title": "オープニング",
      "text": "既存のTypeScript/JavaScript運用の課題と対応づけて説明できる状態になることで",
      "pause_length_ms": 200
    },
    {
      "utterance_id": "U005",
      "section_id": 1,
      "section_title": "オープニング",
      "text": "す。",
      "pause_length_ms": 320
    },
    {
      "utterance_id": "U006",
      "section_id": 1,
      "section_title": "オープニング",
      "text": "ここで扱うのは導入判断の軸であり、文法の細部やAPI暗記ではありません。",
      "pause_length_ms": 340
    },
    {
      "utterance_id": "U007",
      "section_id": 2,
      "section_title": "前提を呼び起こす",
      "text": "比較対象は、TypeScriptでの実装・設計パターンです。",
      "pause_length_ms": 340
    },
    {
      "utterance_id": "U008",
      "section_id": 2,
      "section_title": "前提を呼び起こす",
      "text": "TypeScriptは実務適用しやすく、巨大なJavaScript資産とも接続しやすい一方で、",
      "pause_length_ms": 190
    },
    {
      "utterance_id": "U009",
      "section_id": 2,
      "section_title": "前提を呼び起こす",
      "text": "境界ではanyや型アサーションが混ざり、実行時まで壊れ方が見えない設計が残ることがあります。",
      "pause_length_ms": 360
    },
    {
      "utterance_id": "U010",
      "section_id": 2,
      "section_title": "前提を呼び起こす",
      "text": "よく起きる問題は2つです。",
      "pause_length_ms": 320
    },
    {
      "utterance_id": "U011",
      "section_id": 2,
      "section_title": "前提を呼び起こす",
      "text": "1つ目は、型が通っても分岐漏れや仕様抜けがレビュー後半で発覚すること。",
      "pause_length_ms": 340
    },
    {
      "utterance_id": "U012",
      "section_id": 2,
      "section_title": "前提を呼び起こす",
      "text": "2つ目は、コードベース拡大とともに変更影響の見通しが落ち、保守コストが増えることです。",
      "pause_length_ms": 360
    },
    {
      "utterance_id": "U013",
      "section_id": 2,
      "section_title": "前提を呼び起こす",
      "text": "つまり、型があることと、設計の安全性が運用で担保されることは同じではありません。",
      "pause_length_ms": 320
    },
    {
      "utterance_id": "U014",
      "section_id": 3,
      "section_title": "結論を先に提示",
      "text": "結論は明確です。",
      "pause_length_ms": 320
    },
    {
      "utterance_id": "U015",
      "section_id": 3,
      "section_title": "結論を先に提示",
      "text": "ReScriptは、型制約とデータモデルを先に固定し、",
      "pause_length_ms": 190
    },
    {
      "utterance_id": "U016",
      "section_id": 3,
      "section_title": "結論を先に提示",
      "text": "JavaScriptへコンパイルして運用することで、",
      "pause_length_ms": 190
    },
    {
      "utterance_id": "U017",
      "section_id": 3,
      "section_title": "結論を先に提示",
      "text": "不具合検知を実行時からコンパイル時へ前倒しできます。",
      "pause_length_ms": 320
    },
    {
      "utterance_id": "U018",
      "section_id": 3,
      "section_title": "結論を先に提示",
      "text": "全面置換を前提にしなくても、境界から段階導入するだけで、レビュー品質と変更耐性を改善できます。",
      "pause_length_ms": 360
    },
    {
      "utterance_id": "U019",
      "section_id": 4,
      "section_title": "概念の最小モデル説明",
      "text": "最小モデルは3層で理解します。",
      "pause_length_ms": 320
    },
    {
      "utterance_id": "U020",
      "section_id": 4,
      "section_title": "概念の最小モデル説明",
      "text": "1つ目は、式中心の言語モデルです。",
      "pause_length_ms": 320
    },
    {
      "utterance_id": "U021",
      "section_id": 4,
      "section_title": "概念の最小モデル説明",
      "text": "ReScriptでは評価単位が明確で、値と副作用の扱いを整理しやすい。",
      "pause_length_ms": 340
    },
    {
      "utterance_id": "U022",
      "section_id": 4,
      "section_title": "概念の最小モデル説明",
      "text": "2つ目は、コンパイル時検証です。",
      "pause_length_ms": 320
    },
    {
      "utterance_id": "U023",
      "section_id": 4,
      "section_title": "概念の最小モデル説明",
      "text": "型不一致、分岐漏れ、曖昧な値表現を、実行前に明示的に扱えます。",
      "pause_length_ms": 340
    },
    {
      "utterance_id": "U024",
      "section_id": 4,
      "section_title": "概念の最小モデル説明",
      "text": "3つ目は、実行時モデルです。",
      "pause_length_ms": 320
    },
    {
      "utterance_id": "U025",
      "section_id": 4,
      "section_title": "概念の最小モデル説明",
      "text": "最終的にはJavaScriptとして動くため、Webエコシステムとの接続を維持できます。",
      "pause_length_ms": 360
    },
    {
      "utterance_id": "U026",
      "section_id": 4,
      "section_title": "概念の最小モデル説明",
      "text": "ここで重要なのは、実行基盤を変えずに、設計時点の厳密さを上げられる点です。",
      "pause_length_ms": 340
    },
    {
      "utterance_id": "U027",
      "section_id": 4,
      "section_title": "概念の最小モデル説明",
      "text": "逆に、この回ではReact実装詳細や高度なFFI、全章のAPI解説は扱いません。",
      "pause_length_ms": 360
    },
    {
      "utterance_id": "U028",
      "section_id": 5,
      "section_title": "構造の捉え方",
      "text": "TypeScriptの基本モデルは、JavaScript互換性を重視した柔軟な型付けです。",
      "pause_length_ms": 360
    },
    {
      "utterance_id": "U029",
      "section_id": 5,
      "section_title": "構造の捉え方",
      "text": "現場適用が速い反面、境界の扱い次第で型の保証が薄くなる場面があります。",
      "pause_length_ms": 340
    },
    {
      "utterance_id": "U030",
      "section_id": 5,
      "section_title": "構造の捉え方",
      "text": "ReScriptのモデルは、より厳密な型システムと型推論で、実装前に制約を固定しやすい構造です。",
      "pause_length_ms": 380
    },
    {
      "utterance_id": "U031",
      "section_id": 5,
      "section_title": "構造の捉え方",
      "text": "この違いが、判断タイミングを変えます。",
      "pause_length_ms": 320
    },
    {
      "utterance_id": "U032",
      "section_id": 5,
      "section_title": "構造の捉え方",
      "text": "TypeScript中心だと「実装してから破綻を見つける」寄りになりやすい。",
      "pause_length_ms": 360
    },
    {
      "utterance_id": "U033",
      "section_id": 5,
      "section_title": "構造の捉え方",
      "text": "ReScriptを導入すると「設計時点で破綻を潰す」寄りに移せます。",
      "pause_length_ms": 340
    },
    {
      "utterance_id": "U034",
      "section_id": 5,
      "section_title": "構造の捉え方",
      "text": "つまり、品質活動の重心がテスト後半から設計初期へ移動します。",
      "pause_length_ms": 300
    },
    {
      "utterance_id": "U035",
      "section_id": 6,
      "section_title": "思考を促す問いかけ",
      "text": "ここで問いです。",
      "pause_length_ms": 320
    },
    {
      "utterance_id": "U036",
      "section_id": 6,
      "section_title": "思考を促す問いかけ",
      "text": "あなたのプロダクトでは、最近の不具合や手戻りのうち、",
      "pause_length_ms": 190
    },
    {
      "utterance_id": "U037",
      "section_id": 6,
      "section_title": "思考を促す問いかけ",
      "text": "何割が「境界の曖昧さ」と「分岐の想定漏れ」に起因しているでしょうか。",
      "pause_length_ms": 340
    },
    {
      "utterance_id": "U038",
      "section_id": 6,
      "section_title": "思考を促す問いかけ",
      "text": "もしこの割合が高いなら、導入判断の軸は新機能速度だけでなく、",
      "pause_length_ms": 210
    },
    {
      "utterance_id": "U039",
      "section_id": 6,
      "section_title": "思考を促す問いかけ",
      "text": "設計時点で壊れ方を減らせるかに置くべきです。",
      "pause_length_ms": 320
    },
    {
      "utterance_id": "U040",
      "section_id": 7,
      "section_title": "実務への接続",
      "text": "実務上の効果は3点です。",
      "pause_length_ms": 320
    },
    {
      "utterance_id": "U041",
      "section_id": 7,
      "section_title": "実務への接続",
      "text": "1つ目はバグの早期検知。",
      "pause_length_ms": 320
    },
    {
      "utterance_id": "U042",
      "section_id": 7,
      "section_title": "実務への接続",
      "text": "2つ目はレビュー観点の統一。",
      "pause_length_ms": 320
    },
    {
      "utterance_id": "U043",
      "section_id": 7,
      "section_title": "実務への接続",
      "text": "3つ目は長期変更に対する見通し向上です。",
      "pause_length_ms": 320
    },
    {
      "utterance_id": "U044",
      "section_id": 7,
      "section_title": "実務への接続",
      "text": "プロセスとしては、",
      "pause_length_ms": 190
    },
    {
      "utterance_id": "U045",
      "section_id": 7,
      "section_title": "実務への接続",
      "text": "PRレビューの最初に「型で防げる不具合を実装で受けていないか」「境界の責務が明確か」を確認します",
      "pause_length_ms": 200
    },
    {
      "utterance_id": "U046",
      "section_id": 7,
      "section_title": "実務への接続",
      "text": "。",
      "pause_length_ms": 320
    },
    {
      "utterance_id": "U047",
      "section_id": 7,
      "section_title": "実務への接続",
      "text": "これにより、仕様変更時の影響追跡がしやすくなり、回帰リスクを下げられます。",
      "pause_length_ms": 340
    },
    {
      "utterance_id": "U048",
      "section_id": 7,
      "section_title": "実務への接続",
      "text": "特に中規模以上のWebアプリや複数人開発では、この差が運用コストに直結します。",
      "pause_length_ms": 360
    },
    {
      "utterance_id": "U049",
      "section_id": 8,
      "section_title": "まとめ",
      "text": "最初に決めるべきは3つです。",
      "pause_length_ms": 320
    },
    {
      "utterance_id": "U050",
      "section_id": 8,
      "section_title": "まとめ",
      "text": "導入境界、ビルド統合、そしてTS/JSとReScript間のデータ受け渡しルールです。",
      "pause_length_ms": 320
    },
    {
      "utterance_id": "U051",
      "section_id": 8,
      "section_title": "まとめ",
      "text": "適用範囲は、型安全と保守性を重視する中規模以上のプロダクトで特に有効です。",
      "pause_length_ms": 340
    },
    {
      "utterance_id": "U052",
      "section_id": 8,
      "section_title": "まとめ",
      "text": "一方で、この回の範囲外は、具体文法の深掘り実装と高度な連携実装です。",
      "pause_length_ms": 300
    },
    {
      "utterance_id": "U053",
      "section_id": 8,
      "section_title": "まとめ",
      "text": "次回以降で、式評価・不変性・制御フローに進み、導入判断を実装判断へ接続します。",
      "pause_length_ms": 360
    },
    {
      "utterance_id": "U054",
      "section_id": 8,
      "section_title": "まとめ",
      "text": "今回の内容は、導入価値の判断に限定し、文法詳細やReact実装手順には踏み込みません。",
      "pause_length_ms": 360
    }
  ],
  "dictionary_candidates": [
    {
      "surface": "実装",
      "reading_or_empty": "ジッソウ",
      "priority": "HIGH",
      "occurrences": 9,